{
  "format_version": "1.0",
  "session_id": "example-vae-vacation",
  "project": "Polyvalent vacation e-bike",
  "category": "vae",
  "created_at": "2026-09-28",
  "updated_at": "2026-09-28",
  "stage": "VALIDATION",
  "requirements_file": "requirements.json",
  "products_file": "products.json",
  "evidence_file": "evidence.json",
  "configurations_file": "configurations.json",
  "scenarios": ["vacation-allround"],
  "blocking_unknowns": [
    "Exact battery-removed weight of shortlisted fatbikes",
    "Manufacturer definition of advertised payload"
  ],
  "next_actions": [
    "Read manufacturer replies",
    "Recompute towbar rack compatibility"
  ],
  "skill_versions": {
    "purchase-research": "1.3.0",
    "vae-research": "1.0.0"
  }
}